{
  "name": "enterprise-saas",
  "version": "1.0",
  "description": "Grille générique pour solutions SaaS B2B hors secteurs régulés. Utilisable pour CRM, RH, collaboratif, productivity, marketing, data. Pondérations équilibrées sans critère dominant.",
  "sector": "generic-b2b",
  "date_last_updated": "2026-04-16",
  "criteria": [
    {
      "id": "maturite",
      "name": "Maturité de la solution",
      "weight": 0.2,
      "description": "Ancienneté, base clients, stabilité produit. Un SaaS mature a >3 ans de recul production et >100 clients.",
      "scale": [
        { "value": 1, "label": "< 20 clients, < 2 ans", "requires": "Année + nb clients" },
        { "value": 2, "label": "20-50 clients, 2-4 ans", "requires": "Idem" },
        { "value": 3, "label": "50-200 clients, 4-7 ans", "requires": "Idem + REX publics" },
        { "value": 4, "label": "200-1000 clients, 7-10 ans", "requires": "Idem + analyste cité" },
        { "value": 5, "label": "> 1000 clients, leader Gartner/Forrester/G2", "requires": "Position leader reconnue" }
      ]
    },
    {
      "id": "references",
      "name": "Références clients",
      "weight": 0.15,
      "description": "Qualité et pertinence des références publiques. Références du même secteur/taille que le client cible sont prioritaires.",
      "scale": [
        { "value": 1, "label": "Aucune référence publique", "requires": "Page clients éditeur" },
        { "value": 2, "label": "1-3 références dont taille modeste", "requires": "Logos" },
        { "value": 3, "label": "Page références fournie, secteurs multiples", "requires": "Logos + case studies" },
        { "value": 4, "label": "Références CAC40 ou équivalent sectoriel, case studies récents", "requires": "Noms + chiffres" },
        { "value": 5, "label": "Références massives, plusieurs CAC40 + témoignages publics récents (< 12 mois)", "requires": "Témoignages + presse" }
      ]
    },
    {
      "id": "conformite",
      "name": "Conformité (ISO 27001 / SOC 2 / RGPD)",
      "weight": 0.15,
      "description": "Certifications de sécurité et conformité applicables en B2B. ISO 27001 et SOC 2 Type II sont le standard.",
      "scale": [
        { "value": 1, "label": "Aucune certification", "requires": "Check registres" },
        { "value": 2, "label": "RGPD documenté uniquement", "requires": "DPO + politique" },
        { "value": 3, "label": "ISO 27001 OU SOC 2 Type I", "requires": "Certificat" },
        { "value": 4, "label": "ISO 27001 ET SOC 2 Type II + RGPD", "requires": "Tous certificats" },
        { "value": 5, "label": "Idem + certifications sectorielles (PCI DSS, HIPAA si applicable) + audits publics récents", "requires": "Audits < 12 mois publics" }
      ]
    },
    {
      "id": "interoperabilite",
      "name": "Interopérabilité (API / SSO / webhooks)",
      "weight": 0.15,
      "description": "Capacité à s'intégrer à un SI B2B standard. API publique documentée, SSO, webhooks sont les prérequis modernes.",
      "scale": [
        { "value": 1, "label": "Aucune API, aucun SSO", "requires": "Doc éditeur" },
        { "value": 2, "label": "API limitée, SSO basique", "requires": "Doc API" },
        { "value": 3, "label": "API REST documentée + SSO SAML + quelques webhooks", "requires": "Documentation publique" },
        { "value": 4, "label": "API complète REST/GraphQL + SAML/OIDC + webhooks + connecteurs natifs (Salesforce, HubSpot, Slack, Teams)", "requires": "Doc + liste connecteurs" },
        { "value": 5, "label": "Idem + SDK multiples langages + marketplace d'intégrations + support iPaaS (Zapier, Make, Workato)", "requires": "Marketplace publique" }
      ]
    },
    {
      "id": "economie",
      "name": "Modèle économique",
      "weight": 0.2,
      "description": "Transparence tarifaire, TCO prévisible, soutenabilité éditeur.",
      "scale": [
        { "value": 1, "label": "Pricing opaque + éditeur fragile", "requires": "Recherche financière éditeur" },
        { "value": 2, "label": "Demande commerciale requise, pricing variable", "requires": "Discussion commerciale" },
        { "value": 3, "label": "Grille tarifaire partielle publique (tiers basiques)", "requires": "Page pricing" },
        { "value": 4, "label": "Pricing public par tier + calculateur + TCO documenté", "requires": "Calculateur public" },
        { "value": 5, "label": "Pricing public + flexibilité contractuelle + SLA publiques + garanties financières", "requires": "SLA publiées" }
      ]
    },
    {
      "id": "support_services",
      "name": "Support et services",
      "weight": 0.15,
      "description": "Qualité du support technique, disponibilité, langues, écosystème partenaires pour déploiement.",
      "scale": [
        { "value": 1, "label": "Support par e-mail uniquement, anglais, heures ouvrées", "requires": "Contrat type" },
        { "value": 2, "label": "Support e-mail + chat, multilingue limité", "requires": "Canaux support" },
        { "value": 3, "label": "Support 24/5 + chat + base de connaissance + partenaires FR", "requires": "SLA support" },
        { "value": 4, "label": "24/7 premium + CSM dédié + réseau partenaires intégrateurs en France", "requires": "Liste partenaires" },
        { "value": 5, "label": "24/7 + CSM + écosystème riche intégrateurs FR/UE + university/formation certifiante", "requires": "Programme partenaires + cursus" }
      ]
    }
  ],
  "weight_total_check": 1.0,
  "tie_breakers": [
    { "priority": 1, "criterion": "maturite" },
    { "priority": 2, "criterion": "support_services" },
    { "priority": 3, "criterion": "economie" }
  ],
  "usage_notes": [
    "Grille générique B2B. Pour un client régulé (santé, finance, public), préférer health-ai.json ou regulated-industries.json.",
    "Pondérations équilibrées : aucun critère > 20%. Rééquilibrer si le cas d'usage met plus de poids sur un axe."
  ]
}
